Company,URL,Title,Description,Date
Agfa-Gevaert N.V.,"http://www.bing.com/cr?IG=9367EFE107CF4DEBAE63EE90E7E58BB9&CID=36F0697BAB2C6C780FCC6041AABC6D77&rd=1&h=3y962beF7RjI9E9YfyBJlaZfXH9A-4E1FF7lHVyZ0eY&v=1&r=http%3a%2f%2fwww.medgadget.com%2f2016%2f06%2fhealthcare-cloud-computing-market-will-hit-us12653-4-million-in-2020.html&p=DevEx,5020.1","Healthcare Cloud Computing Market will hit US$12,653.4 million in 2020","Some of the other major players in healthcare cloud computing market are Agfa-Gevaert N.V., CareCloud Corporation, Dell Inc, ORACLE CORPORATION, GE Healthcare and Merge Healthcare Incorporated. Persistence Market Research (PMR) is a third-platform research ...",2016-06-07T03:11:00
Agfa-Gevaert N.V.,"http://www.bing.com/cr?IG=9367EFE107CF4DEBAE63EE90E7E58BB9&CID=36F0697BAB2C6C780FCC6041AABC6D77&rd=1&h=8bz4Uzm3ylMQtehMU9iNcjO6wJmQhX4OAIk4y22dGZo&v=1&r=http%3a%2f%2fwww.4-traders.com%2fnews%2fAgfa-HealthCare-Identified-in-KLAS-Report-as-Being-Among-Early-Leaders-to-Connect-Multiple-S--22534342%2f&p=DevEx,5022.1",Agfa HealthCare :* Identified in KLAS Report** as Being Among Early Leaders*** to Connect Multiple Service Lines for Enterprise Imaging,please visit http://www.agfahealthcare.com/global/en/main/resources/index.jsp Follow us at Twitter [https://twitter.com/AgfaHealthCare ] Agfa and the Agfa rhombus are trademarks of Agfa-Gevaert N.V. Belgium or its affiliates. XERO is a trademark of Agfa ...,2016-06-16T14:04:00
Agfa-Gevaert N.V.,"http://www.bing.com/cr?IG=9367EFE107CF4DEBAE63EE90E7E58BB9&CID=36F0697BAB2C6C780FCC6041AABC6D77&rd=1&h=N21hCqqlMjxCaZvPOFLSxYud-nO1PNGEFbmhqS-yjV4&v=1&r=http%3a%2f%2fwww.finanznachrichten.de%2fnachrichten-2016-06%2f37613364-teleradiology-market-size-to-reach-dollar-8-24-billion-by-2024-grand-view-research-inc-008.htm&p=DevEx,5024.1","Teleradiology Market Size to Reach $8.24 Billion by 2024: Grand View Research, Inc","The globalteleradiology marketis expected to reach over USD 8.24 billion by 2024 according to a new report by Grand View Research, Inc. The introduction of technology-enabled, accurate, and real-time medical imaging devices favor their application in ...",2016-06-07T10:56:00
Agfa-Gevaert N.V.,"http://www.bing.com/cr?IG=9367EFE107CF4DEBAE63EE90E7E58BB9&CID=36F0697BAB2C6C780FCC6041AABC6D77&rd=1&h=9j4surAz92oYiQnYNFEF6OFrIG0IUY10lJbDEZyZ1uw&v=1&r=http%3a%2f%2fwww.openpr.com%2fnews%2f343708%2fWestern-Europe-Teleradiology-Market-Analysis-Size-Share-Growth-Trends-and-Forecast-Report-2015-2023.html&p=DevEx,5026.1","Western Europe Teleradiology Market Analysis, Size, Share, Growth, Trends and Forecast Report 2015 - 2023","Finally, the report profiles major players in the teleradiology market in Western Europe including Agfa-Gevaert N.V., Cybernet Medical Corporation, ONRAD, Inc., Sectra AB, Telemedicine Clinic, and Global Diagnostics Limited. Each of the companies is ...",2016-06-08T07:08:00
Agfa-Gevaert N.V.,"http://www.bing.com/cr?IG=9367EFE107CF4DEBAE63EE90E7E58BB9&CID=36F0697BAB2C6C780FCC6041AABC6D77&rd=1&h=E-fwJwqiNEQ0PAShdjkG1pF52z2ziHAnwH14AVnfaFE&v=1&r=http%3a%2f%2fwww.printedelectronicsworld.com%2farticles%2f2181%2fh-c-starck-clevios-patent-cross-licensing-agreement-with-agfa-gevaert&p=DevEx,5028.1",H.C. Starck Clevios Patent Cross-Licensing Agreement with Agfa-Gevaert,"H.C. Starck Clevios GmbH , the world's leading supplier of conductive polymers, is pleased to announce the establishment of a cross licensing agreement with Agfa-Gevaert N.V. Agfa-Gevaert N.V., Mortsel, Belgium . This agreement resolves outstanding ...",2010-04-12
Agfa-Gevaert N.V.,"http://www.bing.com/cr?IG=9367EFE107CF4DEBAE63EE90E7E58BB9&CID=36F0697BAB2C6C780FCC6041AABC6D77&rd=1&h=t6Tnes_DTghL4bcR4ZgQDbpFWNZWM1nq9c5zdRWAzkg&v=1&r=http%3a%2f%2fwww.stock-world.de%2fnachrichten%2fadhoc%2fOrion-upgrades-full-year-outlook-for-2016-n7249386.html&p=DevEx,5030.1",Orion upgrades full-year outlook for 2016,07:20 Esperite N.V.: important rec. 14.06 Ciber ... 14.06 Zodiac Aerospace reports a . 14.06 Agfa-Gevaert :Publication of. 14.06 EQS-Adhoc: Accu Holding A. 14.06 EQS-Adhoc: AEVIS VICTOR. 14.06 ArcelorMittal Announces Off. 14.06 Notification according ...,2016-06-15T07:52:00
Agfa-Gevaert N.V.,"http://www.bing.com/cr?IG=9367EFE107CF4DEBAE63EE90E7E58BB9&CID=36F0697BAB2C6C780FCC6041AABC6D77&rd=1&h=wor77GaWSiy304KSf_yC3-c2PLKrJ4rDhGwbPs1Var4&v=1&r=http%3a%2f%2fwww.whatech.com%2fmarket-research%2fmedical%2f167226-demand-for-x-ray-equipment-market-turns-medical-devices-fields-analysis-2016-to-2022-available-in-new-report&p=DevEx,5032.1",Demand for x-ray equipment market turns medical devices fields analysis 2016 to 2022 available in new report,"Other players involved in the x-ray equipment market are Fujifilm Holdings Corporation, Agfa-Gevaert N.V., MinXRay, Inc., Konica Minolta, Inc., Hologic, Inc., Hitachi Medical Corporation, and Varian Medical Systems, Inc. Thus, the well established ...",2016-06-03T10:54:11
Agfa-Gevaert N.V.,"http://www.bing.com/cr?IG=9367EFE107CF4DEBAE63EE90E7E58BB9&CID=36F0697BAB2C6C780FCC6041AABC6D77&rd=1&h=GBzXSkw1eNt7xaPQzWNFWTRjPrSdX7d13VUrCm4ChDY&v=1&r=http%3a%2f%2fwww.bloomberg.com%2fresearch%2fstocks%2fprivate%2fsnapshot.asp%3fprivcapId%3d5477017&p=DevEx,5034.1",Company Overview of Agfa-Gevaert NV & Co. KG,"Agfa-Gevaert NV & Co. KG is based in Cologne, Germany. Agfa-Gevaert NV & Co. KG operates as a subsidiary of Agfa-Gevaert N.V. Agfa-Gevaert NV & Co. KG does not have any Key Executives recorded.",2016-06-13T07:18:00
Agfa-Gevaert N.V.,"http://www.bing.com/cr?IG=9367EFE107CF4DEBAE63EE90E7E58BB9&CID=36F0697BAB2C6C780FCC6041AABC6D77&rd=1&h=-vnGwLL22_wl9bfORe2QFCibRqFYpt2QzBVDC9KBBRI&v=1&r=http%3a%2f%2fwww.prnewswire.com%2fnews-releases%2fglobal-electroactive-polymers-eaps-industry-300276663.html&p=DevEx,5036.1",Global Electroactive Polymers (EAPs) Industry,The report profiles 69 companies including many key and niche players such as - Agfa-Gevaert N.V Celanese Corporation Enthone Electronics Solutions Hyperion Catalysis International KEMET Corporation Read the full report: http://www.reportlinker.com ...,2016-05-30T18:13:00
Agfa-Gevaert N.V.,"http://www.bing.com/cr?IG=9367EFE107CF4DEBAE63EE90E7E58BB9&CID=36F0697BAB2C6C780FCC6041AABC6D77&rd=1&h=yUebRJozL1EcI7QdLYOnrpwhadmwK8mfJdfYeIgEyCE&v=1&r=http%3a%2f%2fwww.reuters.com%2farticle%2fidUS51653%2b03-May-2011%2bHUG20110503&p=DevEx,5038.1",Agfa HealthCare implementing additional price increases of up to 70% on medical film,"For more information on Agfa HealthCare, please visit www.agfahealthcare.com Agfa and the Agfa rhombus are trademarks of Agfa-Gevaert N.V. Belgium or its affiliates. All rights reserved. All information contained herein is intended for guidance purposes ...",2011-05-03T01:46:00
Agfa-Gevaert N.V.,"http://www.bing.com/cr?IG=9367EFE107CF4DEBAE63EE90E7E58BB9&CID=36F0697BAB2C6C780FCC6041AABC6D77&rd=1&h=j7dD9kEkQp5jt_9we6FEk0bmB5uJTXIMDfXkgNahhAY&v=1&r=http%3a%2f%2fwww.marketwired.com%2fpress-release%2fAgfa-HealthCare-Breaks-Ground-Waterloo-Bolstering-Investment-Healthcare-IT-Innovation-1119107.htm&p=DevEx,5040.1",Agfa HealthCare Breaks Ground in Waterloo; Bolstering Investment in Healthcare IT Innovation,Agfa and the Agfa rhombus are trademarks of Agfa-Gevaert N.V. Belgium or its affiliates. IMPAX is a trademark of Agfa HealthCare N.V. Belgium or its affiliates. All rights reserved. All information contained herein is intended for guidance purposes only ...,2010-02-18T13:40:00
Agfa-Gevaert N.V.,"http://www.bing.com/cr?IG=9367EFE107CF4DEBAE63EE90E7E58BB9&CID=36F0697BAB2C6C780FCC6041AABC6D77&rd=1&h=B4MTHHkPjqQLThIpX08vcFKsSy6RA7TJoAG_-irRSt4&v=1&r=http%3a%2f%2fembedded-computing.com%2fnews%2fhealthcare-4-million-2020-globally%2f&p=DevEx,5042.1","Healthcare Cloud Computing Market expected to reach US$12,653.4 million in 2020, Globally","Some of the other major players in healthcare cloud computing market are Agfa-Gevaert N.V., CareCloud Corporation, Dell Inc, ORACLE CORPORATION, GE Healthcare and Merge Healthcare Incorporated. PMR for Journalist: www.persistencemarketresearch.com/page ...",2016-06-08
Agfa-Gevaert N.V.,"http://www.bing.com/cr?IG=9367EFE107CF4DEBAE63EE90E7E58BB9&CID=36F0697BAB2C6C780FCC6041AABC6D77&rd=1&h=NQNp-vZYuNeQfZjseO0U73mobFVUEgaETAzKZbIHyLo&v=1&r=http%3a%2f%2fwww.nature.com%2fnature%2fjournal%2fv402%2fn6764%2ffull%2f402865a0.html&p=DevEx,5044.1",Enhanced yield of photoinduced electrons in doped silver halide crystals,"Laboratoire de Physico-Chimie des Rayonnements, associé au CNRS, Université Paris-Sud, 91405 Orsay, France Agfa-Gevaert N.V., R&D Laboratories, 27 Septestraat, 2640 Mortsel, Belgium Correspondence to: Jacqueline Belloni 1 Correspondence and requests for ...",1999-10-18
Agfa-Gevaert N.V.,"http://www.bing.com/cr?IG=9367EFE107CF4DEBAE63EE90E7E58BB9&CID=36F0697BAB2C6C780FCC6041AABC6D77&rd=1&h=rzuy0n5rBHgvEJD7x2UGSaC8ut-NgqbesG4TAxBt_xw&v=1&r=http%3a%2f%2fwww.sbwire.com%2fpress-releases%2fcomputer-aided-detection-marke%2frelease-691175.htm&p=DevEx,5046.1",Computer Aided Detection Market - North America Accounted for the Largest Share of Global CAD Market,"Key players profiled in this report include Agfa-Gevaert N.V., EDDA Technology, Inc., Fujifilm Medical Systems, Inc., GE Healthcare, Hologic, Inc., Hitachi Medical Corporation, Invivo Corporation, iCAD, Inc., McKesson Corporation, Philips Healthcare ...",2016-05-20T19:28:32
Agfa-Gevaert N.V.,"http://www.bing.com/cr?IG=9367EFE107CF4DEBAE63EE90E7E58BB9&CID=36F0697BAB2C6C780FCC6041AABC6D77&rd=1&h=ELOvwEEPj1UL_bN4qBQLUwgjfLB8SzO6HRkRXaJUeps&v=1&r=http%3a%2f%2ffinance.yahoo.com%2fnews%2felectroactive-polymers-eaps-global-strategic-095300007.html&p=DevEx,5048.1",Electroactive Polymers (EAPs) - Global Strategic Business Report 2016 - Research and Markets,"Research and Markets has announced the addition of the ""Electroactive Polymers (EAPs) - Global Strategic Business Report"" report to their ... including many key and niche players such as Agfa-Gevaert N.V. (Belgium) Celanese Corporation (US) Enthone ...",2016-05-26T09:53:00
Agfa-Gevaert N.V.,"http://www.bing.com/cr?IG=9367EFE107CF4DEBAE63EE90E7E58BB9&CID=36F0697BAB2C6C780FCC6041AABC6D77&rd=1&h=EfrcoiJO7gBPSvS9vRobsBS1KRKpWynWJNDSEGqb0eM&v=1&r=http%3a%2f%2fwww.businessinsurance.com%2farticle%2f20160314%2fNEWS06%2f160319940%2frisk-managers-key-to-managing-cyber-exposures-federation-of-european&p=DevEx,5050.1",Risk managers key to managing cyber exposures,"“Businesses, governments and insurers, therefore, need to collaborate. We must act now,” said Mr. Willaert, who is also commissioned corporate risk manager at Agfa-Gevaert N.V. in Mortsel, Belgium. “The boards of organizations need to understand that ...",2016-03-14T09:57:00
Agfa-Gevaert N.V.,"http://www.bing.com/cr?IG=9367EFE107CF4DEBAE63EE90E7E58BB9&CID=36F0697BAB2C6C780FCC6041AABC6D77&rd=1&h=nXUTT2WHbbGyN9LumXhFoeIaBFPf0Cb2h2A6IbO72nY&v=1&r=http%3a%2f%2fwww.redorbit.com%2fnews%2fhealth%2f1498420%2fnexsan_and_agfa_healthcare_announce_marketing_agreement%2f&p=DevEx,5052.1",Nexsan and Agfa HealthCare Announce Marketing Agreement,"For more information on Agfa HealthCare, please visit www.agfa.com/healthcare. Agfa and the Agfa rhombus are trademarks of Agfa-Gevaert N.V. Belgium or its affiliates. IMPAX is a registered trademark of Agfa HealthCare N.V. Belgium or its affiliates.",2008-07-28
Agfa-Gevaert N.V.,"http://www.bing.com/cr?IG=9367EFE107CF4DEBAE63EE90E7E58BB9&CID=36F0697BAB2C6C780FCC6041AABC6D77&rd=1&h=QmVfjzT70FGr1SwJSvk4ajBeBpx4XFATcmK2ERPCv_Q&v=1&r=http%3a%2f%2fempowerednews.net%2fhealthcare-cloud-computing-market-will-reach-at-a-cagr-of-20-1-globally-from-2014-to-2020%2f18188693%2f&p=DevEx,5054.1","Healthcare Cloud Computing Market will reach at a CAGR of 20.1%, Globally from 2014 to 2020","Some of the other major players in healthcare cloud computing market are Agfa-Gevaert N.V., CareCloud Corporation, Dell Inc, ORACLE CORPORATION, GE Healthcare and Merge Healthcare Incorporated. Persistence Market Research (PMR) is a third-platform research ...",2016-06-03T12:35:00
Agfa-Gevaert N.V.,"https://www.bing.com/cr?IG=9367EFE107CF4DEBAE63EE90E7E58BB9&CID=36F0697BAB2C6C780FCC6041AABC6D77&rd=1&h=PBtIYUpfKSjCFmaMXpv20rvEfq09H2jF8P0PmbMckfo&v=1&r=https%3a%2f%2fwashingtontechnology.com%2farticles%2f2001%2f11%2f26%2fibm-agfa-win-500-million-network-imaging-work-for-dod.aspx&p=DevEx,5056.1","IBM, AGFA Win $500 Million Network Imaging Work for DoD","IBM Corp., Armonk, N.Y., and electronic imaging systems provider Agfa-Gevaert N.V., Mortsel, Belgium, have each been given a green light to provide up to $250 million of imaging network products and services to defense hospitals and federal medical ...",2001-11-26
