Company,URL,Title,Description,Date
Cleversafe Inc.,"http://www.bing.com/cr?IG=6DA112D65AC24A56B00DEA8538CC13DB&CID=1D3A3C02A7636B1B11033538A6F36A24&rd=1&h=RRcjwoUnkumtYX6k2xaEj7gh171ng1FUbuPiapfKbRI&v=1&r=http%3a%2f%2fwww.bloomberg.com%2fresearch%2fstocks%2fprivate%2fsnapshot.asp%3fprivcapId%3d28464986&p=DevEx,5023.1","Company Overview of Cleversafe, Inc.","Cleversafe, Inc. develops Web-scale storage solutions. It offers an enterprise storage solution that enables businesses to store, manage, and access data at petabyte scale and more. The company provides content repository, Storage-as-a-Service, enterprise ...",2016-06-15T17:36:00
Cleversafe Inc.,"http://www.bing.com/cr?IG=6DA112D65AC24A56B00DEA8538CC13DB&CID=1D3A3C02A7636B1B11033538A6F36A24&rd=1&h=p-7tPtEPiQZvZWdygW2qNnwFjui4xAh44_hrFPujqF4&v=1&r=http%3a%2f%2fsearchcloudstorage.techtarget.com%2fnews%2f2240210798%2fCleversafe-Inc-bumps-up-performance-for-object-storage-appliance&p=DevEx,5025.1",Cleversafe Inc. bumps up performance for object storage appliance,Object storage vendor Cleversafe Inc. today rolled out two new faster-performing Slicestor appliances -- including an all-flash version-- and a software feature that allows data to bypass erasure coding for faster access. Every cloud storage option has its ...,2013-12-10T17:00:14
Cleversafe Inc.,"http://www.bing.com/cr?IG=6DA112D65AC24A56B00DEA8538CC13DB&CID=1D3A3C02A7636B1B11033538A6F36A24&rd=1&h=Qksd1oYP0p224Lz47DB7jeixByiFbZTJinQsazXZ3Xo&v=1&r=http%3a%2f%2fwww.storagereview.com%2fibm_to_acquire_cleversafe&p=DevEx,5027.1",IBM To Acquire Cleversafe,Today IBM announced that it has entered into a definitive agreement to acquire Cleversafe Inc. later this year. Cleversafe being a lead developer and manufacturer of object-based storage software and appliances will strength IBM’s position in storage and ...,2015-10-05T17:18:50
Cleversafe Inc.,"http://www.bing.com/cr?IG=6DA112D65AC24A56B00DEA8538CC13DB&CID=1D3A3C02A7636B1B11033538A6F36A24&rd=1&h=0Pwo0N6ippFbo4dx8PtucnrRcqx2uZFDY-wjzY1Dd1g&v=1&r=http%3a%2f%2fwww.prnewswire.com%2fnews-releases%2fcleversafe-inc-granted-five-patents-for-dispersed-storage-technology-120270049.html&p=DevEx,5029.1",Cleversafe Inc. Granted Five Patents for Dispersed Storage Technology,"Cleversafe is the first company to commercialize dispersed storage systems. Its proprietary technology defies conventional storage pitfalls by using algorithms to divide data into ""slices"" and disperses them, via secure network connections, to one or more ...",2011-04-20T12:00:00
Cleversafe Inc.,"http://www.bing.com/cr?IG=6DA112D65AC24A56B00DEA8538CC13DB&CID=1D3A3C02A7636B1B11033538A6F36A24&rd=1&h=p4SbWpHf5ADNxl712fry-oXLSqsdQfyZGTHO63jJO_4&v=1&r=http%3a%2f%2fwww.chicagobusiness.com%2farticle%2f20130820%2fBLOGS11%2f130819806%2fbig-dough-for-big-data-cleversafe-lands-55-million&p=DevEx,5031.1",Big dough for big data: Cleversafe lands $55 million,"Cleversafe Inc. has landed a huge pile of cash to continue its expansion and rewrite the code on data storage. Investors, led by New Enterprise Associates, have poured another $55 million into the fast-growing storage-software company in hopes of getting ...",2013-08-20T11:45:30
Cleversafe Inc.,"http://www.bing.com/cr?IG=6DA112D65AC24A56B00DEA8538CC13DB&CID=1D3A3C02A7636B1B11033538A6F36A24&rd=1&h=hIxBWV1YlUhrPDiptD5rhBgRNJ0vsC4G2L5GngWo3rQ&v=1&r=http%3a%2f%2fwww.bizjournals.com%2fchicago%2fnews%2f2013%2f08%2f20%2fcleversafe-lands-55-million-in-funding.html&p=DevEx,5033.1",Cleversafe lands $55 million in funding,"Cleversafe Inc. has raised $55 million in a new round of venture funds that it will use to expand its data storage business. In conjunction with the financing, NEA Managing General Partner Peter Barris will join Cleversafe’s board. Cleversafe makes ...",2013-08-21T08:31:00
Cleversafe Inc.,"http://www.bing.com/cr?IG=6DA112D65AC24A56B00DEA8538CC13DB&CID=1D3A3C02A7636B1B11033538A6F36A24&rd=1&h=gr_NQQQtBv-kz6WoRFZ9ocsTgCLJOlf9yc_0mkh1Dmo&v=1&r=http%3a%2f%2fmspmentor.net%2fcloud-computing%2fcleversafe-datatility-partner-multi-functional-cloud-storage-platform&p=DevEx,5035.1","Cleversafe, Datatility Partner for Multi-functional Cloud Storage Platform","Managed services provider (MSP) Datatility has partnered with data storage solutions provider Cleversafe, Inc. to create a multi-functional cloud storage platform for customers with storage challenges. Datatility's Hydra Cloud, based on Cleversafe’s ...",2013-11-05T14:53:03
Cleversafe Inc.,"http://www.bing.com/cr?IG=6DA112D65AC24A56B00DEA8538CC13DB&CID=1D3A3C02A7636B1B11033538A6F36A24&rd=1&h=uRXjPwGfmv64W40zC7m9v34eb_pWXxsxq9vrVXjs8hs&v=1&r=http%3a%2f%2fwww.reuters.com%2farticle%2fil-cleversafe-idUSnBw055714a%2b100%2bBSW20150105&p=DevEx,5037.1",Cleversafe Named a Leader in IDC MarketScape for Object-Based Storage,"Evaluation Based on Capabilities and Strategies to Serve Growing Enterprise-class Deployments Cleversafe Inc., the industry-leading object-based storage provider, was named a Leader in the IDC MarketScape: Worldwide Object-Based Storage 2014 Vendor ...",2015-01-05T09:05:00
Cleversafe Inc.,"http://www.bing.com/cr?IG=6DA112D65AC24A56B00DEA8538CC13DB&CID=1D3A3C02A7636B1B11033538A6F36A24&rd=1&h=9crTmoFiS442f_SIxtXI0mC-iqdus2g3ibAyFLZL60I&v=1&r=http%3a%2f%2fwww.chicagotribune.com%2fbluesky%2foriginals%2fchi-chris-gladwin-cleversafe-bsi-20140818-story.html&p=DevEx,5039.1",Chris Gladwin: Why starting a tech company might be a marathon instead of a sprint,"... founded technology company Cruise Technologies Inc. and what would become MusicNow Inc. He has spent a decade building his latest startup, Chicago-based Cleversafe Inc. He launched the business in 2004 to create a new way to store large amounts of ...",2014-08-18
Cleversafe Inc.,"http://www.bing.com/cr?IG=6DA112D65AC24A56B00DEA8538CC13DB&CID=1D3A3C02A7636B1B11033538A6F36A24&rd=1&h=wABCIvuaniC6M94gvQ6T_E59OMpAc6x6T_r1giIW9-s&v=1&r=http%3a%2f%2ffinance.yahoo.com%2fnews%2fcleversafe-posts-triple-digit-revenue-140500166.html&p=DevEx,5041.1","Cleversafe Posts Triple-Digit Revenue Growth, Strengthening Market Leadership Position in 1H 2015","Cleversafe, Inc., the web-scale storage market share leader, today announced triple-digit revenue growth in the first half of 2015, capturing new customers like the University of Chicago, Hogarth, and Solid State Solutions. Partnerships with HP and ...",2015-07-28T14:05:00
Cleversafe Inc.,"http://www.bing.com/cr?IG=6DA112D65AC24A56B00DEA8538CC13DB&CID=1D3A3C02A7636B1B11033538A6F36A24&rd=1&h=jRSKAn0hXKgDz_YQ6zheVjrjzZyl4ZKUmHEhiz4Ybeo&v=1&r=http%3a%2f%2fwww.businesswire.com%2fnews%2fhome%2f20151026006648%2fen%2fCleversafe-Participate-2015-OpenStack-Summit-Tokyo&p=DevEx,5043.1",Cleversafe to Participate in 2015 OpenStack Summit in Tokyo,"TOKYO--(BUSINESS WIRE)--Cleversafe, Inc., the web-scale storage market share leader, today announced its continued support for the OpenStack Foundation through participation in the OpenStack Summit in Tokyo. During the four-day conference, the company will ...",2015-10-26T07:09:00
Cleversafe Inc.,"https://www.bing.com/cr?IG=6DA112D65AC24A56B00DEA8538CC13DB&CID=1D3A3C02A7636B1B11033538A6F36A24&rd=1&h=v3FeUt-rUeJkF4lqI1Z9ZS6NzCzrsPa7DLGhsD4VHt8&v=1&r=https%3a%2f%2fwww.smartrecruiters.com%2fIBM%2f92754010-cleversafe-ww-porfolio-marketing-manager-sales-activation&p=DevEx,5045.1",Cleversafe WW Porfolio Marketing Manager - Sales Activation,"In Q4 2015 IBM acquired Cleversafe, Inc. a leading developer and manufacturer of object-based storage software and appliances. The acquisition of Cleversafe has materially strengthened IBM’s leadership positions in storage and hybrid cloud and is fueling ...",2016-05-27T19:00:26
Cleversafe Inc.,"https://www.bing.com/cr?IG=6DA112D65AC24A56B00DEA8538CC13DB&CID=1D3A3C02A7636B1B11033538A6F36A24&rd=1&h=TFbdC-LGbL83_dgz6vri3B20zR3zPVCMcM_rOhtJkdo&v=1&r=https%3a%2f%2fwww.pehub.com%2f2010%2f10%2fcleversafe-seals-314-million-in-series-c-financing%2f&p=DevEx,5047.1",Cleversafe Seals $31.4 Million in Series C Financing,"The company will use the money in part to expand marketing of its dispersed storage platform. Cleversafe Inc., the leader in resilient storage solutions ideally suited for storage clouds, today announced it has received $31.4 million in an extension of its ...",2010-10-28
Cleversafe Inc.,"http://www.bing.com/cr?IG=6DA112D65AC24A56B00DEA8538CC13DB&CID=1D3A3C02A7636B1B11033538A6F36A24&rd=1&h=rLTZqjjHyXNuDPaisyyHtodirB8OUU91j36DHJJl10c&v=1&r=http%3a%2f%2fwww.foxbusiness.com%2fmarkets%2f2015%2f10%2f05%2fibm-buys-cleversafe-to-improve-cloud-storage-offerings.html&p=DevEx,5049.1",IBM Buys Cleversafe To Improve Cloud Storage Offerings,"IBM Corp. agreed to buy privately-held data storage company Cleversafe Inc., along with its 350 patents and 200 employees, on Monday to improve storage capabilities for clients. IBM plans to integrate Cleversafe within its own IBM Cloud business as it ...",2015-10-05T17:05:58
Cleversafe Inc.,"https://www.bing.com/cr?IG=6DA112D65AC24A56B00DEA8538CC13DB&CID=1D3A3C02A7636B1B11033538A6F36A24&rd=1&h=BoPMnWoPCCCjtFvGHdoui4Zl65a17xJcZASBb2UWbjg&v=1&r=https%3a%2f%2fwww.yahoo.com%2fnews%2fbc-il-cleversafe-present-02-10-20110210-053243-367.html&p=DevEx,5051.1",bc-IL-Cleversafe-present 02-10,"They'll show how AONT-RS is proving to be the backbone of a Cleversafe secure dispersed storage system. Resch and Plank will present their findings on Thursday, Feb. 17, 2011, at 9:00am.",2011-02-10
Cleversafe Inc.,"http://www.bing.com/cr?IG=6DA112D65AC24A56B00DEA8538CC13DB&CID=1D3A3C02A7636B1B11033538A6F36A24&rd=1&h=3EXEvvX2XbC1QkPRey0_jCPLcUp_dQ1-hBMlgcUBDlI&v=1&r=http%3a%2f%2fwww.computerworld.com%2farticle%2f2520108%2fdata-center%2fcleversafe-expands-its-dispersed-storage-network-system.html&p=DevEx,5053.1",Cleversafe expands its dispersed storage network system,"Cleversafe Inc. today announced an upgraded version of its dispersed data archive system that doubles storage capacity and adds an all-in-one cabinet for enterprise-class data centers. Cleversafe introduced the dsNet Cabinet 2200, its largest storage array ...",2010-02-25T01:21:00
Cleversafe Inc.,"http://www.bing.com/cr?IG=6DA112D65AC24A56B00DEA8538CC13DB&CID=1D3A3C02A7636B1B11033538A6F36A24&rd=1&h=xt2KQZybVLowoGVDMOemTFBAeSRWOO9cKIh36VJKe-0&v=1&r=http%3a%2f%2fwww.benzinga.com%2fpressreleases%2f14%2f10%2fb4935094%2fcleversafe-works-with-hp-to-expand-the-sale-of-industry-leading-object-&p=DevEx,5055.1",Cleversafe Works With HP to Expand the Sale of Industry-Leading Object-Storage Solution to Customers,"Cleversafe, Inc., the industry-leading object-based storage provider, today announced that they are now able to resell Cleversafe's object-based storage software platform through HP and its partners, in conjunction with the award-winning HP ProLiant Server ...",2014-10-20T09:09:00
Cleversafe Inc.,"http://www.bing.com/cr?IG=6DA112D65AC24A56B00DEA8538CC13DB&CID=1D3A3C02A7636B1B11033538A6F36A24&rd=1&h=YjflaFtmJzVLOId07cc984lDE6G58XmHO9-1bmR53YM&v=1&r=http%3a%2f%2farmonk.dailyvoice.com%2fbusiness%2farmonks-ibm-acquiring-cleversafe%2f594287%2f&p=DevEx,5057.1",Armonk's IBM Acquiring Cleversafe,"ARMONK, N.Y. -- IBM announced it has entered into an agreement to acquire Cleversafe Inc., a leading developer and manufacturer of object-based storage software and appliances. Once the deal closes, IBM will integrate Cleversafe's portfolio into its IBM ...",2015-10-10T21:28:06
Cleversafe Inc.,"http://www.bing.com/cr?IG=6DA112D65AC24A56B00DEA8538CC13DB&CID=1D3A3C02A7636B1B11033538A6F36A24&rd=1&h=KYOul9CU2RixCtfNV2ClxVzwdaqJuZCxD472ZAqZghk&v=1&r=http%3a%2f%2fsiliconangle.com%2fblog%2f2015%2f10%2f06%2fibm-acquires-cleversafe-to-scale-its-public-cloud-into-the-exabytes%2f&p=DevEx,5059.1",IBM acquires Cleversafe to scale its public cloud into the exabytes,The object storage technology that Cleversafe Inc. brings to the table should provide a valuable asset to use against the competition. The dsNet platform builds on the more than 350 patents that the Chicago-based outfit produced over its eleven-year ...,2015-10-06T18:09:05
